{
  "$schema": "http://json-schema.org/draft-07/schema#",
  "title": "Deck Semente (saída do content-pipeline)",
  "description": "Contrato de qualquer dataset semente em src/content/seed/ (hoje, conteúdo autoral — ver content-pipeline/SOURCES.md) e src/data/seedLoader.ts. Um arquivo por deck. Campos de card alinhados ao schema real (ver data-model.md e src/data/schema.ts) desde a implementação do SQLite em 001-flashcard-study-loop.",
  "type": "object",
  "required": ["deckId", "name", "sourceLevel", "source", "extractedAt", "cards"],
  "properties": {
    "deckId": { "type": "string", "description": "Id estável, ex.: 'core-vocabulary-a1'" },
    "name": { "type": "string", "description": "Nome do deck legível por humanos" },
    "sourceLevel": { "type": "string", "enum": ["A1", "A2", "B1", "B2", "C1"] },
    "source": {
      "type": "string",
      "description": "Identificador de fonte rastreável, registrado em content-pipeline/SOURCES.md (Princípio IV da Constituição)"
    },
    "extractedAt": {
      "type": "string",
      "format": "date",
      "description": "Data ISO em que o pipeline gerou este arquivo"
    },
    "cards": {
      "type": "array",
      "minItems": 1,
      "items": {
        "type": "object",
        "required": [
          "word",
          "sentenceBefore",
          "sentenceAfter",
          "translationBefore",
          "translatedWord",
          "translationAfter",
          "emoji",
          "sourceRef"
        ],
        "properties": {
          "word": { "type": "string", "minLength": 1, "description": "A palavra-alvo em inglês" },
          "sentenceBefore": { "type": "string", "description": "Trecho da frase em inglês antes de 'word'" },
          "sentenceAfter": { "type": "string", "description": "Trecho da frase em inglês depois de 'word'" },
          "translationBefore": { "type": "string", "description": "Trecho da tradução em português antes de 'translatedWord'" },
          "translatedWord": { "type": "string", "minLength": 1, "description": "Tradução de 'word' em português" },
          "translationAfter": { "type": "string", "description": "Trecho da tradução em português depois de 'translatedWord'" },
          "emoji": { "type": "string", "description": "Placeholder de imagem (ver Suposições de 002-mvp1-card-screen/spec.md)" },
          "sourceRef": { "type": "string", "description": "Ponteiro de volta para a entrada exata da fonte, para rastreabilidade" }
        }
      }
    }
  }
}
