{
  "deckId": "oxford-3000-a1-a2-sample",
  "name": "Oxford 3000 — A2 (amostra)",
  "sourceLevel": "A2",
  "source": "content-pipeline/SOURCES.md#oxford-3000-a1-a2.sample.json",
  "extractedAt": "2026-08-08",
  "cards": [
    {
      "word": "requests",
      "sentenceBefore": "We listened to all the ",
      "sentenceAfter": " from our guests.",
      "translationBefore": "Ouvimos todos os ",
      "translatedWord": "pedidos",
      "translationAfter": " dos nossos hóspedes.",
      "emoji": "🤝",
      "sourceRef": "oxford-3000-a1-a2-sample#request"
    },
    {
      "word": "journey",
      "sentenceBefore": "Our ",
      "sentenceAfter": " across the mountains took three days.",
      "translationBefore": "Nossa ",
      "translatedWord": "jornada",
      "translationAfter": " pelas montanhas durou três dias.",
      "emoji": "🏔️",
      "sourceRef": "oxford-3000-a1-a2-sample#journey"
    },
    {
      "word": "harvest",
      "sentenceBefore": "The farmers celebrated a great ",
      "sentenceAfter": " this year.",
      "translationBefore": "Os fazendeiros celebraram uma ótima ",
      "translatedWord": "colheita",
      "translationAfter": " este ano.",
      "emoji": "🌾",
      "sourceRef": "oxford-3000-a1-a2-sample#harvest"
    },
    {
      "word": "lecture",
      "sentenceBefore": "The professor gave a fascinating ",
      "sentenceAfter": " on ancient history.",
      "translationBefore": "O professor deu uma ",
      "translatedWord": "palestra",
      "translationAfter": " fascinante sobre história antiga.",
      "emoji": "📚",
      "sourceRef": "oxford-3000-a1-a2-sample#lecture"
    }
  ]
}
