{
  "deckId": "core-vocabulary-a1",
  "name": "Vocabulário Essencial — A1",
  "sourceLevel": "A1",
  "source": "content-pipeline/SOURCES.md#core-vocabulary-a1.json",
  "extractedAt": "2026-08-08",
  "cards": [
    {
      "word": "house",
      "sentenceBefore": "My family lives in a small ",
      "sentenceAfter": " near the beach.",
      "translationBefore": "Minha família mora em uma ",
      "translatedWord": "casa",
      "translationAfter": " pequena perto da praia.",
      "emoji": "🏠",
      "sourceRef": "core-vocabulary-a1#house"
    },
    {
      "word": "water",
      "sentenceBefore": "Please drink more ",
      "sentenceAfter": " every day.",
      "translationBefore": "Por favor, beba mais ",
      "translatedWord": "água",
      "translationAfter": " todos os dias.",
      "emoji": "💧",
      "sourceRef": "core-vocabulary-a1#water"
    },
    {
      "word": "friend",
      "sentenceBefore": "David is my best ",
      "sentenceAfter": " from school.",
      "translationBefore": "David é meu melhor ",
      "translatedWord": "amigo",
      "translationAfter": " da escola.",
      "emoji": "🤗",
      "sourceRef": "core-vocabulary-a1#friend"
    },
    {
      "word": "school",
      "sentenceBefore": "The children walk to ",
      "sentenceAfter": " every morning.",
      "translationBefore": "As crianças vão andando para a ",
      "translatedWord": "escola",
      "translationAfter": " todas as manhãs.",
      "emoji": "🏫",
      "sourceRef": "core-vocabulary-a1#school"
    },
    {
      "word": "family",
      "sentenceBefore": "We have dinner together as a ",
      "sentenceAfter": " every Sunday.",
      "translationBefore": "Nós jantamos juntos em ",
      "translatedWord": "família",
      "translationAfter": " todo domingo.",
      "emoji": "👨‍👩‍👧",
      "sourceRef": "core-vocabulary-a1#family"
    },
    {
      "word": "food",
      "sentenceBefore": "The ",
      "sentenceAfter": " at this restaurant is delicious.",
      "translationBefore": "A ",
      "translatedWord": "comida",
      "translationAfter": " deste restaurante é deliciosa.",
      "emoji": "🍽️",
      "sourceRef": "core-vocabulary-a1#food"
    },
    {
      "word": "day",
      "sentenceBefore": "It was a beautiful sunny ",
      "sentenceAfter": ".",
      "translationBefore": "Foi um lindo ",
      "translatedWord": "dia",
      "translationAfter": " ensolarado.",
      "emoji": "📅",
      "sourceRef": "core-vocabulary-a1#day"
    },
    {
      "word": "book",
      "sentenceBefore": "I am reading an interesting ",
      "sentenceAfter": " about space.",
      "translationBefore": "Estou lendo um ",
      "translatedWord": "livro",
      "translationAfter": " interessante sobre o espaço.",
      "emoji": "📖",
      "sourceRef": "core-vocabulary-a1#book"
    },
    {
      "word": "car",
      "sentenceBefore": "He bought a new ",
      "sentenceAfter": " last month.",
      "translationBefore": "Ele comprou um ",
      "translatedWord": "carro",
      "translationAfter": " novo no mês passado.",
      "emoji": "🚗",
      "sourceRef": "core-vocabulary-a1#car"
    },
    {
      "word": "dog",
      "sentenceBefore": "Our ",
      "sentenceAfter": " loves to play in the garden.",
      "translationBefore": "Nosso ",
      "translatedWord": "cachorro",
      "translationAfter": " adora brincar no jardim.",
      "emoji": "🐶",
      "sourceRef": "core-vocabulary-a1#dog"
    },
    {
      "word": "happy",
      "sentenceBefore": "She felt very ",
      "sentenceAfter": " after the good news.",
      "translationBefore": "Ela ficou muito ",
      "translatedWord": "feliz",
      "translationAfter": " depois da boa notícia.",
      "emoji": "😊",
      "sourceRef": "core-vocabulary-a1#happy"
    },
    {
      "word": "big",
      "sentenceBefore": "They live in a ",
      "sentenceAfter": " city with many people.",
      "translationBefore": "Eles moram em uma cidade ",
      "translatedWord": "grande",
      "translationAfter": " com muita gente.",
      "emoji": "🏙️",
      "sourceRef": "core-vocabulary-a1#big"
    },
    {
      "word": "small",
      "sentenceBefore": "The kitten was too ",
      "sentenceAfter": " to jump onto the bed.",
      "translationBefore": "O gatinho era ",
      "translatedWord": "pequeno",
      "translationAfter": " demais para pular na cama.",
      "emoji": "🐱",
      "sourceRef": "core-vocabulary-a1#small"
    },
    {
      "word": "eat",
      "sentenceBefore": "We usually ",
      "sentenceAfter": " breakfast at seven o'clock.",
      "translationBefore": "Nós geralmente ",
      "translatedWord": "comemos",
      "translationAfter": " o café da manhã às sete horas.",
      "emoji": "🍳",
      "sourceRef": "core-vocabulary-a1#eat"
    },
    {
      "word": "sleep",
      "sentenceBefore": "Children need to ",
      "sentenceAfter": " at least nine hours a night.",
      "translationBefore": "As crianças precisam ",
      "translatedWord": "dormir",
      "translationAfter": " pelo menos nove horas por noite.",
      "emoji": "😴",
      "sourceRef": "core-vocabulary-a1#sleep"
    },
    {
      "word": "work",
      "sentenceBefore": "My father goes to ",
      "sentenceAfter": " by train every day.",
      "translationBefore": "Meu pai vai ",
      "translatedWord": "trabalhar",
      "translationAfter": " de trem todos os dias.",
      "emoji": "💼",
      "sourceRef": "core-vocabulary-a1#work"
    },
    {
      "word": "money",
      "sentenceBefore": "She saved ",
      "sentenceAfter": " to buy a new bicycle.",
      "translationBefore": "Ela economizou ",
      "translatedWord": "dinheiro",
      "translationAfter": " para comprar uma bicicleta nova.",
      "emoji": "💰",
      "sourceRef": "core-vocabulary-a1#money"
    },
    {
      "word": "time",
      "sentenceBefore": "We don't have much ",
      "sentenceAfter": " before the train leaves.",
      "translationBefore": "Nós não temos muito ",
      "translatedWord": "tempo",
      "translationAfter": " antes de o trem partir.",
      "emoji": "⏰",
      "sourceRef": "core-vocabulary-a1#time"
    },
    {
      "word": "rain",
      "sentenceBefore": "The ",
      "sentenceAfter": " stopped just before the game started.",
      "translationBefore": "A ",
      "translatedWord": "chuva",
      "translationAfter": " parou pouco antes de o jogo começar.",
      "emoji": "🌧️",
      "sourceRef": "core-vocabulary-a1#rain"
    },
    {
      "word": "sun",
      "sentenceBefore": "The ",
      "sentenceAfter": " was shining brightly over the ocean.",
      "translationBefore": "O ",
      "translatedWord": "sol",
      "translationAfter": " estava brilhando forte sobre o oceano.",
      "emoji": "🌞",
      "sourceRef": "core-vocabulary-a1#sun"
    }
  ]
}
